field,category,provisional,local,parent,obligation,searchable in,retain order,facet,displayed,label,definition,rationale,relevance importance (1=most imp),endeca equivalent,notes,implementation details,documentation,issue ct,mapping ct,done in mta?,tests?
status (items),item data,n,y,items,{1},x,x,x,"brief record, full record",(none),Status of individual item,"Shows user whether item is available, library use only, checked out (and when due), missing, etc. Feeds into bib availability value",x,Statuses,x,"Output human-readable status. Institution-specific status messages are output at item level. These will be mapped to a standardized, central set of broader ""status"" categories for use outside individual item display",https://github.com/trln/data-documentation/blob/master/argot/examples/items.md,0,3,,
subject_chronological_facet,subject,n,n,x,"{0,n}",facet,x,Time period,facet value,x,Chronological/time period terms from LCSH,Explode subject genre headings into segments to allow filtering/narrowing by individual chronological terms,?,Subject: Time period,"field_name doesn't include name of a vocabulary because we've never treated chronological terms from different vocabularies separately;;;TD-347 specifies ""limited to LCSH,"" though Endeca data model allowed terms from other vocabularies to be mapped here",https://github.com/trln/data-documentation/blob/master/argot/processing_rules_and_procedures.md#all-fields-that-become-facet-values,.,1,8,,
subject_genre_facet,subject,n,n,x,"{0,n}",facet,x,Genre,facet value,x,Genre/form terms,Explode subject and genre headings into segments to allow filtering/narrowing by individual genre/form terms,?,Subject: Genre,field_name doesn't include name of a vocabulary because we've never treated genre terms from different vocabularies separately. I'll be making a case to POs that it's necessary to include terms from several non-LCSH vocabularies in this facet to make it at all useful. ,https://github.com/trln/data-documentation/blob/master/argot/processing_rules_and_procedures.md#all-fields-that-become-facet-values,.,2,25,,
subject_geographic_facet,subject,n,n,x,"{0,n}",facet,x,Region,facet value,x,Geographic/region terms from LCSH,Explode subject genre headings into segments to allow filtering/narrowing by individual geographic terms,?,Subject: Region,"field_name doesn't include name of a vocabulary because we've never treated chronological terms from different vocabularies separately;;;TD-347 specifies ""limited to LCSH,"" though Endeca data model allowed terms from other vocabularies to be mapped here",https://github.com/trln/data-documentation/blob/master/argot/processing_rules_and_procedures.md#all-fields-that-become-facet-values,.,1,8,,
subject_topic_lcsh_facet,subject,n,n,x,"{0,n}",facet,x,Subject,facet value,x,Topical terms from Library of Congress Subject Headings (LCSH),Explode subject headings into segments to allow filtering/narrowing by individual topical terms,?,Subject: Topic,"field_name includes ""lcsh"" because in Endeca, we also have a Medical Subject headings topic facet -- erring on the side of being more specific earlier on, based on Luke's advice that it'd be easier to generalize things later on than to tease out lost specifics;;;TD-347 specifies ""limited to LCSH,"" though Endeca data model allowed terms from other vocabularies to be mapped here",https://github.com/trln/data-documentation/blob/master/argot/processing_rules_and_procedures.md#all-fields-that-become-facet-values,.,1,19,,
subject_topic_mesh_facet,subject,y,n,x,"{0,n}",facet,x,Medical Subject,facet value,x,Topical terms from MEdical Subject Headings (MeSH),Explode medical subject headings into segments to allow filtering/narrowing by individual topical terms,?,Medical Subject: Topic,x,.,.,1,0,,
subject_topic_other,subject,y,n,x,"{0,n}",facet,x,Subject,facet value,x,Topical terms from non-LCSH/MeSH vocabularies,Explode subject headings into segments to allow filtering/narrowing by individual topical terms. Endeca did not limit this facet to LCSH,?,Subject: Topic,x,.,.,1,0,,
subjects,subject,n,n,x,"{0,n}",subject;;;keyword,y,x,Full record,This item is about,Pre-coordinate subject headings,"Display in record (in order); adaptive hyperlinking for browsing/exploring; feed into autosuggest and/or ""related titles"" features",,Subjects;;;Subject Headings,x,x,x,0,0,,
summary (holdings),holdings data,n,y,holdings,"{0,1}",x,y,x,"institution- and/or format-specific decision (brief record, full record)",(none),"For serials (and for some institutions, monographic series or sets), statement indicating what the library/location has for the title (volumes/years held, gaps, etc) ",See what the library/location has without having to look through all the individual items/volumes,x,SerialHoldingsSummary > Serial Summary,x,"While there will be only 1 'summary' element per 'holding' hash within the 'holdings' array, multiple summary statements may be concatenated into that 'summary' element. In this case, keep the concatenated values in original record order.",https://github.com/trln/data-documentation/blob/master/argot/examples/holdings.md,0,1,,
title_abbreviated,title,n,n,x,"{0,n}",title;;;keyword,y,x,n,x,Abbreviated version of title_main,Support searching when people copy/paste info from citations which use title abbreviations.,.,Journal Title Abbreviation,x,x,x,0,1,,
title_former_note,title,,,,,,,,,,"Note (publicatio ifo, otes, etc) about title former note etry",,,,,,,0,0,,
title_main,title,n,n,x,{1},title;;;keyword,x,,,,,,,Main Title,,,,0,0,,
type (items),item data,n,y,items,"{0,1}",x,x,x,?,?,Type/format for individual item,?,x,ItemTypes,x,.,https://github.com/trln/data-documentation/blob/master/argot/examples/items.md,0,0,,
uniform_title,title,n,n,x,"{0,1}",title;;;keyword,x,x,.,.,Consistent/controlled version of the work title,"Retrieve/collocate works where title has been recorded differently on separate versions (different language title, wording/spelling changed, etc.)",high,Main Uniform Title;;;Uniform Title;;;Journal Uniform Title,"This should definitely be a separate searchable string in the title index, but unsure whether it needs to be displayed on its own -- it will be part of the work_citation field which is probably more suitable for display",.,.,0,3,,
upc,ids,n,n,x,"{0,n}",ids;;;keyword,y,x,Full record,UPC:' + #{upc} + #{upc_qualifying_info} ,Universal product code. Numeric/indexed portion only,Syndetics API data match point. Possible search term,x,UPC,,,,0,0,,
upc_qualifying_info,id display,n,n,x,"{0,n}",x,y,x,Full record,UPC:' + #{upc} + #{upc_qualifying_info} ,Universal product code. Qualifying info only,Contextualizes what UPC is given,x,x,x,"If no qualifying info is given for a UPC in a record, this MUST be set to """"",.,0,0,,
url,url,n,y,x,"{0,n}",x,y,x,.,.,.,.,x,Finding Aid URL;;;Primary URL;;;Repository URL;;;Secondary URL;;;Thumbnail URL,x,.,.,0,0,,
url[access],url,y,y,url,{1},x,x,x,x,x,Type of access: open or restricted,Involved in logic for displaying URLs when expanded to TRLN,x,x,x,.,.,0,0,,
url[href],url,n,y,url,{1},x,x,x,x,x,The actual URL,Target location of hyperlink,x,x,x,.,.,0,0,,
url[rel],url,n,y,url,{1},x,x,x,x,x,"URL relator, or type of URL",Different types of URLs need to be displayed in different parts of the record and/or labeled differently,x,x,x,.,.,0,0,,
url[text],url,n,y,url,{1},x,x,x,x,x,Link text,The text that will be made into a clickable hyperlink pointing to the url[href] value,x,x,x,.,.,0,0,,
value (oclc_number),ids,n,y,oclc_number,"{0,1}",ids;;;keyword,x,x,Full record,.,OCLC record number,.,.,OCLCNumber,.,"Digits only. Strip off ocn/ocm/on prefixes. If coming from 035, remove (OCoLC)",.,0,3,,
vendor_marc_id,ids,n,y,x,"{0,n}",ids;;;keyword,x,x,?,.,MARC record control number assigned by source other than OCLC,"Staff search, possibly of use for rolling up e-resources or other format records, if institutions use the same MARC record source",x,x,x,x,x,0,0,,
virtual_collection,meta,n,y,x,"{0,n}",virtual collection,x,.,x,x,"Collection/group names searchable but not displayed anywhere. Can be used to scope special searches, power various logic, etc.",Needed by institutions.,x,x,x,x,x,0,1,,
vol (items),item data,n,y,items,"{0,1}",x,x,x,"brief record, full record",.,Volume indicator/designator,Tell volumes of serials/sets/etc apart. Sort items? ,x,x,x,.,https://github.com/trln/data-documentation/blob/master/argot/examples/items.md,0,1,,
